Date,News 1,News 2,News 3,News 4,News 5,News 6,News 7,News 8,News 9,News 10
2024-07-10,3 top ASX 200 income stocks to buy now,,,,,,,,,
2024-07-11,"Co by się stało , gdyby Rosja zaatakowała kraj NATO ? Tak wyglądałaby reakcja w pierwszych godzinach",,,,,,,,,
2024-07-12,"Rays vs Guardians Predictions , Picks , Odds 7 - 12",,,,,,,,,
2024-07-13,Nieuwe coalitie gemeente Hoeksche Waard,,,,,,,,,
2024-07-14,Jamrichová triumfovala vo dvojhre junioriek vo Wimbledone | Tenis - Šport | Články,,,,,,,,,
2024-07-15,Ostateczny cios w starciu tyranów . To wtedy Hitler przegrał wojnę,,,,,,,,,
2024-07-16,Panama clears $10bn biofuels project | Latest Market News,,,,,,,,,
2024-07-17,Fundacja gen . Różańskiego z pieniędzmi od MON,,,,,,,,,
2024-07-18,Renewed massive police violence and media smears against Gaza protesters in Germany,,,,,,,,,
2024-07-19,Картина дня : дайджест главных новостей от 19 июля 2024 года,,,,,,,,,
2024-07-20,Here how the ASX 200 market sectors stacked up last week,,,,,,,,,
2024-07-21,Jak i gdzie poglądy Kamali Harris różnią się od poglądów Joe Bidena,,,,,,,,,
2024-07-22,Wybory do Senatu . Stanisław Pawlak zapewnił sukces Lewicy,,,,,,,,,
2024-07-23,"Twins vs Phillies Predictions , Picks , Odds 7 - 23",,,,,,,,,
2024-07-24," „ My , Polki , przestajemy czuć się bezpiecznie . Ciężkie ciosy w stronę Tuska po skandalach z migrantami",,,,,,,,,
2024-07-25,"Angels vs A Predictions , Picks , Odds 7 - 25",,,,,,,,,
2024-07-26,Psucie państwa - Nasz Dziennik,,,,,,,,,
2024-07-27,"Padres vs Orioles Predictions , Picks , Odds 7 - 27",,,,,,,,,
2024-07-28,"Wielka kasa , polityka , deweloperzy i … migranci . UJAWNIAMY , kto i jak rozdzieli nieruchomości warte miliardy",,,,,,,,,
2024-07-29,UNDP OP7 SGP Indigenous Peoples Fellowship Initiative Programme 2024 – Opportunities For Africans,,,,,,,,,
2024-07-30,Szatan . Jak przedstawiany jest diabeł w poszczególnych religiach ? ,,,,,,,,,
2024-07-31,"Lions vs Blue Bombers Prediction , Picks , & Odds",,,,,,,,,
2024-08-01,"Tigers vs Royals Predictions , Picks , Odds 8 - 1",,,,,,,,,
2024-08-02,Decyzja motywowana politycznie ? Ordo Iuris o wątpliwościach wokół bezkarności Nergala,,,,,,,,,
2024-08-03,"Argonauts vs Stampeders Prediction , Picks , & Odds",,,,,,,,,
2024-08-04,"Mariners vs Phillies Predictions , Picks , Odds 8 - 4",,,,,,,,,
2024-08-05,"Cardinals vs Mets Predictions , Picks , Odds 8 - 5",,,,,,,,,
2024-08-06,"Guardians vs Diamondbacks Predictions , Picks , Odds 8 - 6",,,,,,,,,
2024-08-07,SunLive - Paris 2024 : Tauranga sailor proud of campaign,,,,,,,,,
2024-08-08,"Yankees vs Angels Predictions , Picks , Odds 8 - 8",,,,,,,,,
2024-08-09,Cohen & Steers Announces Changes to Realty Indexes,,,,,,,,,
2024-08-10,"Red Sox vs Astros Predictions , Picks , Odds 8 - 10",,,,,,,,,
2024-08-11,,,,,,,,,,
2024-08-12,"Guardians vs Cubs Predictions , Picks , Odds 8 - 12",,,,,,,,,
2024-08-13,"Red Sox vs Rangers Predictions , Picks , Odds 8 - 13",,,,,,,,,
2024-08-14,Mission in the Rain : Sam Grisman Project to play Earl Scruggs Fest,,,,,,,,,
2024-08-15,"Liberty vs Sparks Predictions , Picks & Odds – 8 - 15",,,,,,,,,
2024-08-16,David  Dawg  Grisman Preps  Bare Bones Volume II  Duo Collection with Jerry Garcia,,,,,,,,,
2024-08-17,"Lynx vs Mystics Predictions , Picks & Odds – 8 - 17",,,,,,,,,
2024-08-18,"Sparks vs Aces Predictions , Picks & Odds – 8 - 18",,,,,,,,,
2024-08-19,Uranium Miner Global Atomic Corporation ( TSX : GLO ) ( OTCQX : GLATF ) Gains on News,,,,,,,,,
2024-08-20,"Długi cień paktu Ribbentrop - Mołotow . Nikt nie przypuszczał , że to będzie wstęp do wojny",,,,,,,,,
2024-08-21,Zólyomban kerül sor a szlovák nemzeti felkelés valódi csatáinak rekonstrukciójára,,,,,,,,,
2024-08-22,"Zarząd PKP Cargo deklaruje , że będzie kontynuować działania dla ratowania spółki",,,,,,,,,
2024-08-23,CFL Betting : CFL Bets and Props for Week 12,,,,,,,,,
2024-08-24,"Elks vs Alouettes Prediction , Picks , & Odds",,,,,,,,,
2024-08-25,"Astros vs Orioles Predictions , Picks , Odds 8 - 25",,,,,,,,,
2024-08-26,"Mystics vs Storm Predictions , Picks & Odds – 8 - 26",,,,,,,,,
2024-08-27,BetMGM Launches New Features Ahead of NFL Season,,,,,,,,,
2024-08-28,"Yankees vs Nationals Predictions , Picks , Odds 8 - 28",,,,,,,,,
2024-08-29,Szokujące informacje ! Chińskie patenty podbijają united states ,,,,,,,,,
2024-08-30,"Western Kentucky vs Alabama Prediction , Picks & Odds – College Football Week 1",,,,,,,,,
2024-08-31,85 . rocznica wybuchu II wojny światowej . Dzień Weterana Walk o Niepodległość RP,,,,,,,,,
2024-09-01,USC vs LSU Prediction – Best College Football Week 1 Picks,,,,,,,,,
2024-09-02,"Yankees vs Rangers Predictions , Picks , Odds 9 - 2",,,,,,,,,
2024-09-03,Buy Telstra and these ASX dividend shares in September,,,,,,,,,
2024-09-04,"Yankees vs Rangers Predictions , Picks , Odds 9 - 4",,,,,,,,,
2024-09-05,"Updated Bet365 Bonus Code DIMERS : Secure $1 , 200 Bonus and special NFL parlay boosts for the Chiefs - Ravens game tonight",,,,,,,,,
2024-09-06,These ASX dividend stocks could be top buys for passive income,,,,,,,,,
2024-09-07,"Bet365 Bonus Code CO DIMERS update : Secure $1 , 200+ NCAAF betting bonus and special parlay boosts for Deion Sander Buffs tonight",,,,,,,,,
2024-09-08,"FanDuel Promo Code : Bet $5 on Rams - Lions for $200 Bonus , NFL Sunday Ticket",,,,,,,,,
2024-09-09,"BetMGM Bonus Code NEWSWEEK1500 : Claim $1 , 500 Bet Offer for Jets - 49ers",,,,,,,,,
2024-09-10,"Rangers vs Diamondbacks Predictions , Picks , Odds 9 - 10",,,,,,,,,
2024-09-11,"Arizona State vs Texas State Prediction , Picks & Odds – College Football Week 3",,,,,,,,,
2024-09-12,Französischer Wirtschaftsminister wechselt in die Wissenschaft,,,,,,,,,
2024-09-13,"Indiana vs UCLA Prediction , Picks & Odds – College Football Week 3",,,,,,,,,
2024-09-14,  Azja Express . Kolejna awantura G³owackich .  Bêdziemy po ¶ miewiskiem tego programu  ,,,,,,,,,
2024-09-15,"Cubs vs . Rockies Prediction : Expert Picks , Odds , Stats & Best Bets - Sunday , September 15 , 2024",,,,,,,,,
2024-09-16,Bet365 Bonus Code WEEK365 : Choose Between 2 Eagles - Falcons MNF Bonuses,,,,,,,,,
2024-09-17,85 lat temu ZSRS zaatakował walczącą z Niemcami Polskę,,,,,,,,,
2024-09-18,GeenStijl : Nachtwerk in het Stamcafé : de rest van de APB,,,,,,,,,
2024-09-19,FanDuel Promo Code : $200 NFL Bonus for Patriots - Jets TNF,,,,,,,,,
2024-09-20,Polacy nie są „ rusofobami  ,,,,,,,,,
2024-09-21,Monte Cassino : bp Wiesław Lechowicz odprawił Mszę św . przy grobie abp . Józefa Gawliny,,,,,,,,,
2024-09-22,Verbod op gezichtsbedekkende kleding bij demonstraties,,,,,,,,,
2024-09-23,Duda szykuje się na życie po prezydenturze ? Powiedział wprost,,,,,,,,,
2024-09-24,Kamer toch voor inperken cashlimiet tot 3 . 000 euro,,,,,,,,,
2024-09-25,"Plastic pollution : NGO trains , empowers 500 women in FCT – Blueprint Newspapers Limited",,,,,,,,,
2024-09-26,New FanDuel Promo Code Gives $200 Bonus Bets Guaranteed for Cowboys vs Giants,,,,,,,,,
2024-09-27,Thomas Middle School : The  Best  of the Worst ? – The Suburban Times,,,,,,,,,
2024-09-28,Procesy o czary w dawnym Gdańsku,,,,,,,,,
2024-09-29,Prezydent : Nie ma zgody na nielegalnych migrantów,,,,,,,,,
2024-09-30,Francja już nie chce migracji . Rząd obiecuje szczelniejsze granice,,,,,,,,,
2024-10-01,KiteFoil World Series Italy - Preview : KiteFoilers relish a return to Poetto Beach,,,,,,,,,
2024-10-02,"Agent mag bewaking Joodse instellingen niet weigeren , wel  ruimte voor gesprek  ",,,,,,,,,
2024-10-03,Buccaneers vs . Falcons SGP : Best Same - Game Parlay for NFC South Matchup,,,,,,,,,
2024-10-04,"FanDuel Promo Code : Bet $5 , Get $200 for Lynx vs Sun Playoff Game",,,,,,,,,
2024-10-05,2024 KiteFoil World Series Sardinia,,,,,,,,,
2024-10-06,FanDuel Promo Code Releases $200 Guaranteed Bonus for NFL Week 5,,,,,,,,,
2024-10-07,"New FanDuel Promo Code Offer : Bet $5 , Get $300 If Your MNF Bet Wins",,,,,,,,,
2024-10-08,Leger Israël : tientallen Hezbollah - militanten gedood • Doden bij luchtaanval Damascus,,,,,,,,,
2024-10-09,VVD wants 3 - seat threshhold for parliament ; D66 wants to ban parties with 1 member,,,,,,,,,
2024-10-10,"2024 Formula Kite Youth European Championships in Torregrande , Italy",,,,,,,,,
2024-10-11,Drone treft  Nederland verzorgingshuis nabij Tel Aviv • Israël : blauwhelmen  per ongeluk  geraakt,,,,,,,,,
2024-10-12,PiS łączy siły z Suwerenną Polską . Kaczyński i Jaki podpisali deklarację ideową,,,,,,,,,
2024-10-13,Premier : kontrola granic i bezpieczeństwo jest i będzie naszym priorytetem,,,,,,,,,
2024-10-14,Analysts name 3 ASX dividend shares to buy in October,,,,,,,,,
2024-10-15,"ESPN BET Promo Code NEWSWEEK : Land $1 , 000 Bet Reset for Guardians - Yankees",,,,,,,,,
2024-10-16,Komisja rozpatrywała Komunikat Komisji do PE ws . wspólnego planu wdrażania paktu o migracji i azylu,,,,,,,,,
2024-10-17,"UE : Tusk : liczymy , że same zapowiedzi ograniczenia prawa do azylu zniechęcą do nielegalnej migracji ( aktualizacja ) ",,,,,,,,,
2024-10-18,Polska musi przywrócić kontrole na granicy z Niemcami . To wniosek po rzekomym „ sukcesie  Tuska,,,,,,,,,
2024-10-19,LSU vs Arkansas Prediction & Best Bets – NCAAF Week 8 Picks,,,,,,,,,
2024-10-20,Hungary on the path to economic recovery : How the new plan will change the country – INTERVIEW,,,,,,,,,
2024-10-21,"FanDuel Promo Code : Bet $5 , Get a $300 Bonus If It Wins for Ravens vs Buccaneers",,,,,,,,,
2024-10-22,"Assen wil benzineauto uit centrum , Tweede Kamer wil uitstel",,,,,,,,,
2024-10-23,European Parliament Members Urge Designation of IRGC as Terrorist Group Amid Security Concerns,,,,,,,,,
2024-10-24,BetMGM Bonus Code NEWSWEEK200 : Get Slam - Dunk $200 Bonus With $10 NBA Bet,,,,,,,,,
2024-10-25,"Eagles locks and long shots : Take the Birds to win , DeVonta Smith and Saquon Barkley to shine",,,,,,,,,
2024-10-26,"Canadiens vs Blues Prediction , Picks & NHL Odds",,,,,,,,,
2024-10-27,"Bills vs Seahawks Predictions , Picks , & Best Bets – NFL Week 8",,,,,,,,,
2024-10-28,"Predators vs Lightning Prediction , Picks & NHL Odds",,,,,,,,,
2024-10-29,Zorg om schrappen vergunning bij lage stalbezetting,,,,,,,,,
2024-10-30,"Flames vs Utah Prediction , Picks & NHL Odds",,,,,,,,,
2024-10-31,Urbana School District # 116 breaks down results of this year Illinois School Report Card,,,,,,,,,
2024-11-01,Our Expert Patriots vs . Titans same game parlay picks on DraftKings for NFL Week 9,,,,,,,,,
2024-11-02,Commanders vs Giants Same Game Parlay,,,,,,,,,
2024-11-03,Bet365 Bonus Code WEEK365 : $200 Bonus or $1K Bet for Colts vs . Vikings SNF,,,,,,,,,
2024-11-04,Harrison Preparatory and Highline High Schools : A Tale of Two Schools – The Suburban Times,,,,,,,,,
2024-11-05,Boyens Medien : EU - Schuldenregeln : Brüssel wartet auf Berlins Haushaltsplan,,,,,,,,,
2024-11-06,"ESPN BET Promo Code NEWSWEEK : $1 , 000 Bonus for Warriors - Celtics , Any NBA Game",,,,,,,,,
2024-11-07,"The Latest Key Developments in the IoT Data Management Market : Trends , Technologies , and Challenges – Cardinal Courier",,,,,,,,,
2024-11-08,"  To niepoważne bzdury  - Cenckiewicz o tym , jak Jarosław Stróżyk tropił Donalda Trumpa",,,,,,,,,
2024-11-09,Washington vs Penn State Prediction and Picks : Nittany Lions Lean on Allen,,,,,,,,,
2024-11-10,"Bet365 Bonus Code WEEK365 : $150 Bonus , $1K Safety Net for NFL Week 10",,,,,,,,,
2024-11-11,Singles lopen tegen veel ( financiële ) nadelen aan :  Meer bewustzijn nodig in de politiek  ,,,,,,,,,
2024-11-12,Extendicare Announces 2024 Third Quarter Results and Early Redemption of 2025 Debentures,,,,,,,,,
2024-11-13,Oproep tijdens spoeddebat Europees Parlement :  Grijp in bij haatzaaiende organisatie Samidoun  | Binnenland,,,,,,,,,
2024-11-14,Hoe het compromis over de omstreden btw - verhoging ineens toch tot stand kwam,,,,,,,,,
2024-11-15,Beat The TSX With This Cash - Gushing Dividend Stock,,,,,,,,,
2024-11-16,Huczne przyjęcie urodzinowe Aleksandra Kwaśniewskiego,,,,,,,,,
2024-11-17,Co z dzieæmi na polsko - bia³oruskiej granicy ?  Czêsto s± ofiarami przemocy  ,,,,,,,,,
2024-11-18,Co z drewnem energetycznym ? Wiceminister klimatu mówi o  roboczym projekcie  ,,,,,,,,,
2024-11-19,"iQFOiL Asian Championships and iQFOiL International Games starts tomorrow in Shenzhen , China",,,,,,,,,
2024-11-20,Ali appointed medical director for Peeples Cancer Institute,,,,,,,,,
2024-11-21,Trump 2 . 0 : Potential Shifts And Key Considerations In US Antitrust Policy,,,,,,,,,
2024-11-22,Day Three : iQFOiL Asian Championships and International Games - Tricky Conditions test sailors in Shenzhen,,,,,,,,,
2024-11-23,"Texas A & M vs Auburn Predictions , Picks , Odds for College Football Week 13",,,,,,,,,
2024-11-24,"USC vs UCLA Predictions , Picks , Odds for College Football Week 13",,,,,,,,,
2024-11-25,mga puwang . hiwin pro com . data sgp 2024 hari ini live - qiu qiu pro versi lama,,,,,,,,,
2024-11-26,Zgromadzenie Parlamentarne NATO wzywa sojuszników do przekazywania Ukrainie rakiet dalekiego zasięgu,,,,,,,,,
2024-11-27,Minnesota vs Wisconsin Prediction and Picks for College Football Week 14,,,,,,,,,
2024-11-28,Tennessee vs Vanderbilt Prediction and Picks for College Football Week 14,,,,,,,,,
2024-11-29,"Nebraska vs Iowa Predictions , Picks , Odds for College Football Week 14",,,,,,,,,
2024-11-30,"Gabi ng Cocktail . APK SLOT PRAGMATIC MOD Siapkan Dirimu . CHEAT MAHJONG WAYS 1 Sistem Update Mahjong Wins 3 , penuh dengan kesenangan - apk go win slot",,,,,,,,,
2024-12-01,8k866 com login . FDFD SLOT demo slot uang asli . APK CHEAT MAHJONG WAYS 2 slot gacor habanero - apk go win slot,,,,,,,,,
2024-12-02,The Ugly Truth about the Permanent War Economy • Stimson Center,,,,,,,,,
2024-12-03,Woensdag nieuw voorstel coalitie over onderwijsbezuinigingen,,,,,,,,,
2024-12-04,Legendárna pieseň Last Christmas oslávila 40 rokov od vydania ! ,,,,,,,,,
2024-12-05,Rok samotności . Była kanclerz Niemiec Angela Merkel nie chce przepraszać,,,,,,,,,
2024-12-06,Germany election campaign at the expense of refugees - World Socialist Web Site,,,,,,,,,
2024-12-07,SOCA MONARCH BACK,,,,,,,,,
2024-12-08,"Metsola w polskim parlamencie . UJAWNIAMY kulisy spotkania : Rau mówił o łamaniu demokracji , goście w szoku",,,,,,,,,
2024-12-09,phjl . HDI tombol kirim APK . QIU QIU PRO tombol kirim - qiu qiu pro versi lama,,,,,,,,,
2024-12-10,Watch Every World Record From The First Finals Session At 2024 Short Course Worlds,,,,,,,,,
2024-12-11,Coalitie en oppositie akkoord over minder bezuinigen op onderwijs,,,,,,,,,
2024-12-12,ChristenUnie stemt voor het eerst in jaren tegen twee begrotingen,,,,,,,,,
2024-12-13,Wilders blij met UNRWA afbouw ? Het wordt tijd voor een volledige stop : Nederland mag geen terreur sponsoren ! ,,,,,,,,,
2024-12-14,Mocne wystąpienia polityków PiS . To trzeba zobaczyć ! ,,,,,,,,,
2024-12-15,Peilingen ! PVV levert iets in maar behoudt de koppositie : NSC wordt volledig weggevaagd ! ,,,,,,,,,
2024-12-16,Takiego budżetu Radom jeszcze nie miał . Radni uchwalili rekordowe kwoty,,,,,,,,,
2024-12-17,Football Studio . paito sdy sgp hk harian . data hk 6d virdsam - qiu qiu pro versi lama,,,,,,,,,
2024-12-18,Column | Voorkom islamitische zuil : schaf artikel 23 af,,,,,,,,,
2024-12-19,Hoogeveen schrapt plan voor speciale luiercontainers,,,,,,,,,
2024-12-20,Community council concern at proposed 10 - year extension of Sella Ness accommodation block permission,,,,,,,,,
2024-12-21,Wieliński oburzony  wykorzystywaniem zamachu . Co z Tuskiem ? ,,,,,,,,,
2024-12-22,Northern Illinois vs Fresno State Prediction and Picks Famous Idaho Potato Bowl,,,,,,,,,
2024-12-23,311jilipark app download . Page Not Found . KELUARAN SGP 2024 TOGELERS slot freebet new member - qiu qiu pro versi lama,,,,,,,,,
2024-12-24,De politiek blikt terug in 4 vragen,,,,,,,,,
2024-12-25,,,,,,,,,,
2024-12-26,Georgia Tech vs Vanderbilt Prediction and Picks Birmingham Bowl,,,,,,,,,
2024-12-27,"Syracuse vs Washington State Predictions , Picks , Odds for the Holiday Bowl",,,,,,,,,
2024-12-28,Major milestone for Dudley new £26m university campus,,,,,,,,,
2024-12-29,Maaari ba tayong maglaro ng Monopoly online ?. data pengeluaran sgp 2019 sampai 2024 lengkap . link qiu qiu pro - apk go win slot,,,,,,,,,
2024-12-30,Lions vs . 49ers Same Game Parlay : Will Jahmyr Gibbs have big night for Detroit ? ,,,,,,,,,
2024-12-31,"DZ Mafia , the violent Marseilles gang that styles itself as a brand",,,,,,,,,
2025-01-01,,,,,,,,,,
2025-01-02,Column | Gaan we hier terug naar de doodstraf ? ,,,,,,,,,
2025-01-03,Aufruf zu  Mut und Stabilität  beim ersten Ministerrat der Regierung Bayrou,,,,,,,,,
2025-01-04,Buffalo vs Liberty Prediction and Picks Bahamas Bowl,,,,,,,,,
2025-01-05,Deklaracja Trzaskowskiego . Ozdoba : Nie żartujmy sobie,,,,,,,,,
2025-01-06,"Kontrola państwowa : skupimy się na bezpieczeństwie , obronności , służbie zdrowia i edukacji",,,,,,,,,
2025-01-07,JEF i NATO reagują na niszczenie podmorskich kabli na Morzu Bałtyckim,,,,,,,,,
2025-01-08, „ To będzie prezydencja z siedzibą w Brukseli . Morawiecki o „ zaprzepaszczonej szansie  w wykonaniu rządu Tuska,,,,,,,,,
2025-01-09,Provincie moet afschieten wolf mogelijk maken ; BBB en SGP willen spoeddebat,,,,,,,,,
2025-01-10,What are the odds ?: Player parlay bets for the Commanders vs Buccaneers,,,,,,,,,
2025-01-11,FanDuel NFL Best Bets : TSN staff picks for Wild Card Weekend,,,,,,,,,
2025-01-12,,,,,,,,,,
2025-01-13,Grenlandia chce ściśle współpracować z united states w zakresie obrony i górnictwa,,,,,,,,,
2025-01-14,Wellicht streep door opvang asielzoekers in gemeentehuis Hoornaar : coalitie vraagt om heroverwegen besluit,,,,,,,,,
2025-01-15,"Clouds have a surprising effect on surface warming , climate researchers find",,,,,,,,,
2025-01-16,Geen hoorzittingen meer in Tweede Kamer met ministers,,,,,,,,,
2025-01-17,Expert picks for DraftKings Same Game Parlay best bets for Magic vs . Celtics,,,,,,,,,
2025-01-18,How much is Maharlikaâ€™s offer for NGCP ? ,,,,,,,,,
2025-01-19,Krakowski PiS podzielony po ogłoszeniu Ryszarda Terleckiego .  To dramat  ,,,,,,,,,
2025-01-20,"Werkendam krijgt derde haven , bedrijven hebben  chronisch ruimtegebrek  ",,,,,,,,,
2025-01-21,Oppositie wil dat Klever snel geld stuurt naar UNRWA in Gaza,,,,,,,,,
2025-01-22,Ministers : verbod gezichtsbedekkende kleding bij demo moet goed afgebakend zijn,,,,,,,,,
2025-01-23,Should you buy ASX real estate shares before interest rates start to fall ? ,,,,,,,,,
2025-01-24,World Sailing approves 2025 - 2028 Committee appointments,,,,,,,,,
2025-01-25,Trzaskowski jest niewiarygodny . Ale to nie koniec jego problemów – musi się zmierzyć z efektem Trumpa ! ,,,,,,,,,
2025-01-26,25 zetels netto verlies voor de Schoof - coalitie .  De kiezer wil dit ? ,,,,,,,,,
2025-01-27,PiS wycofuje się z kandydatury Barbary Nowak .  Nie przyjęła się  ,,,,,,,,,
2025-01-28,"Czyż z TVP do Trzaskowskiego : Pana konkurent mówi dziwne rzeczy , niedorzeczności kompletne",,,,,,,,,
2025-01-29,Griffier,,,,,,,,,
2025-01-30,Aankoop grond voor huizenbouw bij Brigdamme en Poppenroede gaat door . Maar ook  sprong over de N57  wordt onderzocht,,,,,,,,,
2025-01-31,"Mavericks vs Pistons Prediction , Picks & Odds for Tonight NBA Game",,,,,,,,,
2025-02-01,Karol Nawrocki grzmi : Mamy niemieckie drzewa w polskiej stolicy,,,,,,,,,
2025-02-02,"Nebraska vs Oregon Prediction , Picks & Odds for Tonight College Basketball Game",,,,,,,,,
2025-02-03,"Nieformalny unijny szczyt w Brukseli . Konferencja prasowa z udziałem Donalda Tuska , Antonio Costy i Ursuli von der Leyen",,,,,,,,,
2025-02-04,Trzaskowski o pakcie migracyjnym i rachunku za Ukraińców,,,,,,,,,
2025-02-05,Idlewild Elementary School : An Academic Collapse in Just Five Years . Who Is Responsible ? – The Suburban Times,,,,,,,,,
2025-02-06,Lewica kontra Konfederacja . Konsternacja podczas wywiadu na żywo,,,,,,,,,
2025-02-07,"Gorąco w koalicji .  Macie robić to , co rozkazuje PO  ",,,,,,,,,
2025-02-08,"Donald Tusk zapowiedział , że deportacja przestępców z Polski będzie uproszczona . PiS i KO wyjątkowo zgodne",,,,,,,,,
2025-02-09,Az orvostudomány új dimenziói : a gyógyítás jövője,,,,,,,,,
2025-02-10,Ta petycja do rady miasta Ostrołęki wpłynęła dwukrotnie . Dotyczy nielegalnej migracji,,,,,,,,,
2025-02-11,Lewandowski wsypał Tuska ws . paktu migracyjnego ! WIDEO,,,,,,,,,
2025-02-12,Błaszczak alarmuje : Czeka nas zalew nielegalnych migrantów . PiS chce wypowiedzenia paktu migracyjnego . Składa projekt uchwały,,,,,,,,,
2025-02-13,"Kamer wil probleem - asielzoekers opsluiten , Faber oppert avondklok in Ter Apel",,,,,,,,,
2025-02-14,"Pierwszy dzień konferencji w Monachium . Wojna w Ukrainie , krytyka Europy ze strony united states [ PODSUMOWANIE ] ",,,,,,,,,
2025-02-15,Amerykañscy dyplomaci z wizyt± na Bia³orusi . Wywie¼li winiów politycznych .  Zwrot w polityce united states  | Wiadomo ¶ ci ze ¶ wiata,,,,,,,,,
2025-02-16,Dr Karol Nawrocki odpowiada Rafałowi Trzaskowskiemu ws . bezpieczeństwa,,,,,,,,,
2025-02-17,Wnioski z wojny w Ukrainie . W Polsce powstaje JATEC - centrum analityczne NATO,,,,,,,,,
2025-02-18,24Kurier . pl - Grzegorz Braun w Szczecinie,,,,,,,,,
2025-02-19,"Eksperci o  Wizji dla rolnictwa KE : kierunek dobry , ale za konkretów za mało",,,,,,,,,
2025-02-20,"Canada vs united states Prediction , Picks & Odds for Tonight 4 Nations Face - Off Final",,,,,,,,,
2025-02-21,Elbl±g :  Zbêdne podgrzewanie emocji ? Pomys³ na referendum ws . imigrantów dzieli radnych,,,,,,,,,
2025-02-22,Abp Marek Jędraszewski w 40 - lecie protestu głodowego w Bieżanowie,,,,,,,,,
2025-02-23,"Kraol Nawrocki : nie wysłałbym na Ukrainę polskich żołnierzy , tylko przedsiębiorców",,,,,,,,,
2025-02-24,"Agresja i bluzgi . Zmowa milczenia w sprawie nagrania , które kompromituje senatora Lewicy ?  Nie mają honoru  ",,,,,,,,,
2025-02-25,Szef MON : Każde lotnisko musi być przystosowane do współpracy z wojskiem,,,,,,,,,
2025-02-26,Misja pokojowa czy siły odstraszania ? ,,,,,,,,,
2025-02-27,Mentzen w Szczecinku : wszyscy na Ukrainie traktują nas jak  frajerów  ,,,,,,,,,
2025-02-28,Waterschap in actie tegen varende steigers : SGP Molenlanden wil maatwerk,,,,,,,,,
2025-03-01,Trumps Abkehr von der Ukraine : Was folgt aus dem Zerwürfnis für Deutschland und Europa ? ,,,,,,,,,
2025-03-02,Skupina Fallgrapp uvádza nový singel Nebo,,,,,,,,,
2025-03-03,Katarzyna Sójka dla Niezalezna . pl : te wybory będą referendum nad niszczącymi rządami Donalda Tuska,,,,,,,,,
2025-03-04,Niemcy wyłożą setki miliardów na obronność . Utworzą specjalny fundusz,,,,,,,,,
2025-03-05,Kandydat na prezydenta jednoznacznie : odebrać Ukraińcom 800+,,,,,,,,,
2025-03-06,Weto Węgier na szczycie UE ws . Ukrainy . Ale Unia idzie dalej – DW – 06 . 03 . 2025,,,,,,,,,
2025-03-07,"Benson Boone je späť a s novým singlom dokazuje , že ani zďaleka nekončí ! ",,,,,,,,,
2025-03-08,"SIU EDWARDSVILLE VS SE MISSOURI STATE PREDICTION , PICKS & ODDS FOR TONIGHT OHIO VALLEY CHAMPIONSHIP",,,,,,,,,
2025-03-09,Sikorski kontra Rubio i Musk . Emocje buzują .  Może ktoś mu zabierze Twittera ? [ RELACJA NA ŻYWO ] ,,,,,,,,,
2025-03-10,Polska nie wdroży paktu migracyjnego ? KE przypomina o obowiązkach i zapowiada konsekwencje,,,,,,,,,
2025-03-11,"ST . FRANCIS VS CENTRAL CONNECTICUT PREDICTION , PICKS & BEST BETS FOR TONIGHT NORTHEAST TOURNAMENT CHAMPIONSHIP",,,,,,,,,
2025-03-12,"26 lat Polski w NATO : Nie możemy kwestionować jego roli , nie ma realnej alternatywy",,,,,,,,,
2025-03-13,"Newswire & Press Release / T - Mobile , Thales and SIMPL Ease IoT Deployments with A Flexible and Secure Connectivity Solution - Telecom / Wireless / VoIP / IPTV - Thales Group",,,,,,,,,
2025-03-14,Pretensje do europosłów PiS .  Zareagowali za późno  ,,,,,,,,,
2025-03-15,Bruksela wypycha Amerykę z Europy . Ozdoba dla Niezalezna . pl : to doprowadzi do kryzysu w relacjach,,,,,,,,,
2025-03-16,"OILERS VS RANGERS PREDICTION , PICKS & ODDS FOR TONIGHT NHL GAME",,,,,,,,,
2025-03-17,"FLYERS VS LIGHTNING PREDICTION , PICKS & ODDS FOR TONIGHT NHL GAME",,,,,,,,,
2025-03-18,"First signs of spring on the Susquehanna Greenway | News , Sports , Jobs",,,,,,,,,
2025-03-19,"Opozycja chce kontroli na granicy z Niemcami . Rząd mówi , że to niepotrzebne",,,,,,,,,
2025-03-20,"DRAKE VS MISSOURI PREDICTION , PICKS & ODDS FOR TONIGHT MARCH MADNESS GAME",,,,,,,,,
2025-03-21,"CREIGHTON VS AUBURN PREDICTION , PICKS & ODDS FOR SATURDAY MARCH MADNESS GAME",,,,,,,,,
2025-03-22,"Omroep Flevoland - Nieuws - Besluit over toekomst van De Tong blijkt lastig , onderzoek duurt langer",,,,,,,,,
2025-03-23,"COLORADO STATE VS MARYLAND PREDICTION , PICKS & BEST BETS FOR TODAY MARCH MADNESS GAME",,,,,,,,,
2025-03-24,Trzaskowski o pakcie migracyjnym . Polityk KO o Ukraińcach w Polsce – Wprost,,,,,,,,,
2025-03-25,Oppositiepartijen willen dat college zich uitspreekt tegen bezuinigingen in onderwijs,,,,,,,,,
2025-03-26,Mariusz Błaszczak o programie dr . Karola Nawrockiego,,,,,,,,,
2025-03-27,"DraftKings promo code for March Madness Alabama vs . BYU : Bet $5 , receive $200 in instant bonuses",,,,,,,,,
2025-03-28,Coalitie : nog altijd op zoek naar eenheid,,,,,,,,,
2025-03-29,"ALABAMA VS DUKE PREDICTION , PICKS & ODDS FOR TONIGHT MARCH MADNESS ELITE EIGHT GAME",,,,,,,,,
2025-03-30,Nawrocki o sprawie ukraińskiej podczas pobytu w Przemyślu,,,,,,,,,
2025-03-31,"TCU VS TEXAS PREDICTION , PICKS & BEST BETS FOR TODAY WOMEN MARCH MADNESS ELITE 8 GAME",,,,,,,,,
2025-04-01,"GIANTS VS ASTROS PREDICTION , PICKS & ODDS FOR TODAY MLB GAME",,,,,,,,,
2025-04-02,DraftKings Promo Code Gives New Users $150 Bonus Bets for a $5 Wager on Pistons vs Thunder,,,,,,,,,
2025-04-03,Kabinet : dit jaar nog geen vuurwerkverbod,,,,,,,,,
